{
  "id": "game.prototype-scope.vertical_slice_01",
  "kind": "game.prototype-scope",
  "name": "Vertical Slice 01",
  "description": "First playable prototype scope for proving the extraction loop.",
  "status": "ready",
  "owner": "production",
  "prototypeType": "vertical-slice",
  "goal": "Prove that co-op shard collection, timed collapse pressure, and extraction decisions are compelling in one greybox zone.",
  "includedFeatureRefs": [
    "feature.zone-entry",
    "feature.memory-shards",
    "feature.zone-collapse",
    "feature.extraction-portal"
  ],
  "outOfScope": [
    "full progression economy",
    "liveops events",
    "platform certification"
  ],
  "successCriteria": [
    "Players can complete one extraction session without designer intervention.",
    "The collapse timer creates a clear leave-or-risk-more decision.",
    "Recovered shards connect to a visible upgrade placeholder."
  ],
  "references": [
    {
      "type": "validatesMode",
      "target": "game.mode.coop_extraction"
    },
    {
      "type": "validatesLoop",
      "target": "game.loop.extract_escape_upgrade"
    }
  ]
}
